image_id,description
63428.jpg,a painting of three women in a room
vincent-van-gogh_wheat-field-with-rising-sun-1889.jpg,the wheatfield at sunset by vincent van gogh van gogh van van van van van van van van
122_9.jpg,a drawing of a man sitting at a table with a cat
1035196.jpg,a painting of flowers in a vase
53695.jpg,a painting of two people laying down on the ground
72543.jpg,a painting of a house on a hill
Avenue of Poplars in Autumn.jpg,a painting of a road with trees and a barn
56944.jpg,the last supper by retti
43882.jpg,the ann of the ann of the ann of the ann of the ann of the ann of the
370_11.png,a yellow square painted with a brush
18532.jpg,a painting of a river with mountains in the background
0920_3.jpg,a painting of a man with a feathered hat
228_6.jpg,a statue of a man sitting on a rock
203_60.png,"two black velvet gloves, one with a black velvet collar"
73572.jpg,a painting of a woman holding a bird
56211.jpg,a painting of flowers on a white surface
30966.jpg,a painting of a woman playing a guitar
1 (2805).jpg,a woman with long hair and a black dress
gustave-loiseau_spring-1920.jpg,a painting of a field with trees and flowers
0364.jpg,"portrait of a lady, half length, in a brown dress, with a white collar and a"
41666.jpg,a painting of a man with a bird on his head
1007494.jpg,the ascension of christ
00644_1.jpg,a painting of a village with a woman and a man
jose-maria-velasco_el-popocat-petl-y-el-iztacc-huatl-desde-el-lago-de-chalco-1882.jpg,a painting of a mountain range with a river in the fore
49466.jpg,a painting of a man sitting in a field
240_17.png,a painting of a square with a brown background
1251_5.jpg,a painting of apples and a vase on a table
259_16.png,a black and white tile with a pattern of leaves
31695.jpg,a painting of a street scene with people and buildings
2_86.png,a painting of a woman with a bird on her shoulder
60315.jpg,two women in black robes standing in a park
23382.jpg,a painting of a woman in a purple dress
47423.jpg,three framed paintings of squares and squares
1016_4.jpg,a painting of a man in a yellow vest and red vest
1199_1.jpg,a painting of a woman in a blue dress
41478.jpg,a painting with a green and yellow stripe
46003.jpg,a painting of a woman in a green dress
97147.jpg,the ascension of jesus
vincent-van-gogh_red-vineyards-at-arles-1888.jpg,"the harvest, 1888 by vincent van gogh"
00564.jpg,a painting of two men on horsebacks in a field
22814.jpg,a painting of people in a field with tents
63215.jpg,a painting of a river with trees in the background
54360.jpg,a painting of a farm with a barn in the background
900_1.jpg,a painting of trees in a park
10494.jpg,a painting of a woman in a room
142_6.png,a painting of a circle with a red background
1044362.jpg,a painting of a river with buildings and a boat
75031.jpg,the cave of the giants by william william
77_62.png,a painting of a person with a hand on their chest
20847.jpg,"claude monet, sunset over the seine, 1888"
317_20.png,a green and pink abstract painting with white and red paint
t3_swcna8.jpg,a painting of a field with a sunset in the background
31366.jpg,a painting of a man with a beard
16919.jpg,a blue and green painting with a square shape
9347.jpg,a painting of a woman walking down a street
2_133.png,the painting is a painting by picasso picasso picasso picasso picasso picasso picasso picasso picasso picasso picasso picasso picasso
28571.jpg,a painting of a vase with circles and circles
85408.jpg,"a painting of a red, white and blue abstract design"
31258.jpg,a painting of a young girl in a landscape
92132.jpg,a painting of a village with a dog
0067_2.jpg,a portrait of a man in a black coat and white shirt
107_39.png,a blue and orange flower shaped chair
6_12.jpg,a painting of the virgin of the immaculate mother
88028.jpg,a painting of a square with a brown and blue border
203_9.png,a black and white painting on a white surface
15970.jpg,a painting of a river with a sky in the background
23375.jpg,a print of a group of indians
14165.jpg,abstract background with yellow and black shapes
43280.jpg,a woman in a black dress sitting on a chair
53457.jpg,a woman in a pink shirt sitting on a couch
the-japanese-bridge-the-water-lily-pond-and-path-by-the-water-1.jpg,claude monot's garden at givetten
719_4.jpg,"person, the person, person, person, person, person, person, person, person,"
0436_3.jpg,a painting of a man in a military uniform
62_25.png,a painting of a plant with leaves and flowers
50400.jpg,a painting of people outside a house
t3_vaxoa1.jpg,a painting of a rock formation in the desert
2c52b24385.jpg,a blue butterfly sitting on a branch with pink flowers
5786_mainfoto_05_1.jpg,a pair of bronze busts
1057477.jpg,a painting of oranges and grapes on a table
279_7.png,a painting with a white square on the bottom
2073_2.jpg,a painting of two people in formal clothing
1050063.jpg,a painting of a man on a bicycle
1952_mainfoto_05_3.jpg,a pair of 19th century indian paintings
62575.jpg,a painting of a woman in a yellow dress
21631.jpg,a painting of a man in a black suit
24271.jpg,a couple dressed in costumes and hats
30004504.jpg,"the cover art for the album, the devil's daughter"
t3_utt96m_1.jpg,a basket of apples on a table with a cloth
1042032.jpg,a painting of apples and a glass on a table
35854.jpg,a painting of people in a landscape
1595_2.jpg,a painting of a man with a feathered hat
25_10.jpg,a drawing of a woman holding an umbrella
11121777.jpg,a painting of a street with a table and chairs
35339.jpg,a painting of a woman in a pink dress and a man in a black suit
56963.jpg,a painting of a man laying on a table
63043.jpg,a painting of a man with a rifle in a field
t3_vd3jok.jpg,a painting of a woman in a bed
129_21.png,a black and white painting of a pattern
39849.jpg,a painting of a village with trees and buildings
47241.jpg,two women in a landscape by henri dupree
