image_id,description
62_16.png,a painting of a vase with flowers in it
0203_2.jpg,a painting of a family in a landscape
4547.jpg,a painting of people walking on a path
1165_3.jpg,a painting of a man digging a tree
1101191.jpg,a painting of a vase and a vase on a table
92286.jpg,a painting of a white and black object
0152_1.jpg,a painting of a boy in a red cloak
57114.jpg,a white plate with purple and green glass shards
109_7.png,"person,'the chair ', 1938"
42720.jpg,a painting of a man in a black coat and white shirt
10016.jpg,a portrait of a man in a fur coat
92100.jpg,a painting of a cityscape
356_4.png,a black box with a brown and white cat inside
2_155.png,a painting of a woman and a man
394_9.png,a pink horse with a black nose and a blue nose
23992.jpg,a portrait of a man in a red coat
17154.jpg,a painting of a woman sitting on a chair
34867.jpg,a painting of a horse and a man laying on the grass
32041.jpg,a painting of a man in uniform with a gun
11917.jpg,a painting with a yellow and blue square on it
27059.jpg,the ann and st john
1134_1.jpg,"a view of the palace of versailles, with the palace of versailles in the background"
244_16.png,a drawing of a spiral design
16549.jpg,a black and white drawing of a family
68629.jpg,a book cover with a blue and yellow painting
38705.jpg,a painting of a man in a canoe on a lake
1597_5.jpg,a painting of a woman sitting on a chair
90967.jpg,the martyr of st peter by retti
camille-pissarro_grey-day-banks-of-the-oise-1878.jpg,a painting of a wooded scene with a house in the distance
239_4.jpg,a statue of a man with wings on his head
claude-monet_the-seine-near-argenteuil.jpg,"the seine, 1888 by claude - jean - louis"
204_132.png,a painting with a white sheet of paper
0792_2.jpg,a portrait of a man in a black coat and white shirt
1274_2.jpg,a painting of a woman in a blue dress
51926.jpg,a painting of a woman playing the violin
1380_2.jpg,a painting of people on a beach
102115.jpg,a painting of a tractor in a city
1036351.jpg,a painting of a table with a vase and a vase of flowers
1843_1.jpg,a painting of a man on a horse with a bird flying above him
Abstract_image_2064.jpg,a piece of paper with a circle on it
2051_mainfoto_05.jpg,a man sitting in a chair reading a book
108_7.jpg,a painting of a fence in the grass
1 (2805) 11.28.58.jpg,a woman with long hair and a black dress
13472.jpg,a painting with green and blue stripes
172_21.png,a painting of a bird on a white background
56078.jpg,a painting of a woman in a green dress
34056.jpg,a painting of a man in a black cloak
0308_2.jpg,a painting of a city with a river and buildings
1045851.jpg,a painting of a mountain scene with trees and a river
2267.jpg,a painting of a young girl in a black dress
t3_t1umat.jpg,a painting of a fire in the middle of a field
64902.jpg,a painting of a river with a man on a horse drawn by a man
57290.jpg,a painting of a woman sitting on a couch
14411.jpg,a painting of a woman in a red dress
427_27.png,a circle with a blue and green design
1474_5.jpg,a painting of a woman in a blue dress
101696.jpg,a painting of a street with houses in the background
262_6.jpg,"the virgin of the immaculate, painted by artist julia"
claude-monet_the-estuary-of-the-siene.jpg,a painting of a road with a house in the background
64352.jpg,a painting of a boy standing in a field
100292.jpg,a painting of people walking on a bridge
10713.jpg,a painting of a woman in a black dress
1557.jpg,a painting of a woman in a white dress
17_70.png,a painting of waves
3142_mainfoto_05_1.jpg,a statue in the park
t3_utk4xg_1.jpg,a dog with a white face and black eyes
33115.jpg,a painting of two women in a field
16967.jpg,a painting of a family with two children
2_225.png,a framed picture of a man with a dog
298_1.jpg,a painting of person holding a cross
366_7.jpg,"the virgin of the virgin, painted by the artist, is shown in this painting"
90958.jpg,a painting of a canal in the city
1782_2.jpg,a painting of a river with trees and water lilies
318_1.jpg,an icon of the person holding a book
45978.jpg,a painting of a man with a hat and a bag
19517.jpg,"the cover of the book, the art of the modern age"
13907.jpg,a painting of a beach scene with a horse and a man on the shore
t3_k59p3p_1.jpg,a group of people riding horses through a field
1044294.jpg,a painting of oranges in a blue vase
2335_2.jpg,a painting of people on a river
Portrait of a Young Peasant.jpg,a painting of a man in a striped shirt and hat
t3_un8ddu.jpg,a painting of a tree in the park
0260_2.jpg,a painting of a woman in a blue dress
13_87.png,a book with a picture of a woman in a red dress
t3_jxanw9.jpg,a painting of a girl holding a cat
357_11.png,a white wall with black squares on it
73323.jpg,a painting of a face with a black and white background
26024.jpg,a painting of a mountain town with a church in the distance
8_32.png,"two men in a bathroom, one sitting on the floor"
5051.jpg,a painting of two men playing drums
0193_1.jpg,a painting of a man on a horse with a bird flying above him
45853.jpg,a painting of a green and yellow square
10785.jpg,a painting of a woman sitting on a chair
176_27.png,a painting of a red flower on a green background
james-caulfeild-fourth-viscount-charlemont-later-first-earl-of-charlemont-1756.jpg,a painting of a man in a green jacket and red pants
17717.jpg,a painting of a forest with trees and a man walking
393_187.png,a drawing of a spiral in white on a black background
185_17.png,a red and yellow piece of coral
0663_2.jpg,a painting of a man in a red robe holding a staff
60439.jpg,a painting of a woman sitting at a table
